{
  "schema_version": 2,
  "seq": 1,
  "run_id": "run-fixture-r2",
  "ts": "2026-07-18T00:00:00Z",
  "stage": "intake",
  "event_type": "stage_transition",
  "event_name": "intake_started",
  "from_status": null,
  "to_status": "running",
  "reason_code": "normal_progress",
  "subjects": [
    "run:fixture-r2"
  ],
  "evidence_refs": [
    "evidence/intake/summary.json"
  ],
  "next_actions": [
    {
      "action_id": "review-intake-scope",
      "action_type": "review",
      "subject_ids": [
        "run:fixture-r2"
      ],
      "summary": "Review the recorded intake scope.",
      "evidence_refs": [
        "evidence/intake/summary.json"
      ]
    }
  ],
  "expected_state_revision": 0,
  "details": {
    "summary": "Audit intake started for a sanitized fixture.",
    "reason_detail": "The fixture records ordinary workflow progress only.",
    "metadata": [
      {
        "key": "fixture_kind",
        "value": "sanitized"
      }
    ]
  }
}
